{
  "command": "score",
  "corpus_snapshot_digest": "ee48e793c91d367181aedf16e51a19265e55b627cf0ae8a8e325ae6ee27e2bca",
  "created_at_utc": "2026-06-30T00:00:00Z",
  "environment_digest": "c8a487a4d2334d018080e7924ba749d9b46638eaf75ed0da08173061af86fe29",
  "harness_digest": "eebbfc4539d48453b6f19761f210bb69aca4801f5279d9d6d8b416fec932e0e2",
  "input_ledger_head": "74e6a30fa3e4dc129df8ce439f188ac08b2644a964d52cc1e27ded7df9385e76",
  "receipt_version": "daylight-v14c-plus-receipt-v0.2",
  "result": "pass",
  "scorecard_digest": "22985838b9bdbc8bcefb751b78c67529f712c33965669c213de5ffc64db858d4",
  "source_digest": "d75f316dc5ff20e7edd7571aaabd938a3dedac5a4bdb1913d8e07af0347939f0"
}
